{
  "artifact_id": "hs-demo-inspection-001",
  "artifact_type": "inspection-checklist",
  "artifact_version": "0.1.0",
  "hazard_domain": [
    "hydrogen",
    "pressure",
    "ignition",
    "ventilation",
    "gas-detection",
    "inspection"
  ],
  "lifecycle_stage": "inspection",
  "scope": {
    "project_id": "demo-project-003",
    "facility_reference": "redacted-demo-facility",
    "system_boundary": "Documentation-only inspection evidence boundary for demo equipment.",
    "jurisdiction": null,
    "sensitive_data_embedded": false
  },
  "issuer": {
    "organization": "StegVerse-Labs",
    "role": "HydraSafe documentation author",
    "authority_class": "documentation-author"
  },
  "review_posture": {
    "state": "review-required",
    "required_roles": [
      "authority-having-jurisdiction",
      "qualified-professional",
      "asset-owner",
      "operator"
    ],
    "completed_reviews": []
  },
  "canonical_references": [
    {
      "reference_type": "diamondops-canonical",
      "identifier": "StegVerse-Labs/DiamondOps-Core/docs/LIABILITY_BOUNDARY.md",
      "digest": null,
      "retrieved_at": null
    }
  ],
  "evidence_references": [],
  "status": "draft",
  "disposition": "review-required",
  "created_at": "2026-09-02T12:53:00Z",
  "updated_at": "2026-09-02T12:53:00Z",
  "integrity": {
    "algorithm": "sha256",
    "content_digest": "0000000000000000000000000000000000000000000000000000000000000000",
    "canonicalization": "jcs-rfc8785",
    "payload_included": true,
    "signature_reference": null
  },
  "authority_boundary": {
    "physical_control": false,
    "permit_issuance": false,
    "engineering_approval": false
  },
  "payload": {
    "items": [
      {
        "id": "INS-001",
        "state": "open"
      },
      {
        "id": "INS-002",
        "state": "open"
      }
    ]
  }
}
