{
  "artifact_id": "hs-demo-incident-response-001",
  "artifact_type": "incident-response-playbook",
  "artifact_version": "0.1.0",
  "hazard_domain": [
    "hydrogen",
    "reactive-gas",
    "pressure",
    "ignition",
    "incident-response"
  ],
  "lifecycle_stage": "incident-response",
  "scope": {
    "project_id": "demo-project-004",
    "facility_reference": "redacted-demo-facility",
    "system_boundary": "Documentation-only incident evidence and review boundary.",
    "jurisdiction": null,
    "sensitive_data_embedded": false
  },
  "issuer": {
    "organization": "StegVerse-Labs",
    "role": "HydraSafe documentation author",
    "authority_class": "documentation-author"
  },
  "review_posture": {
    "state": "review-required",
    "required_roles": [
      "asset-owner",
      "operator",
      "qualified-professional",
      "authority-having-jurisdiction"
    ],
    "completed_reviews": []
  },
  "canonical_references": [
    {
      "reference_type": "diamondops-canonical",
      "identifier": "StegVerse-Labs/DiamondOps-Core/docs/LIABILITY_BOUNDARY.md",
      "digest": null,
      "retrieved_at": null
    }
  ],
  "evidence_references": [],
  "status": "draft",
  "disposition": "review-required",
  "created_at": "2026-09-02T12:53:00Z",
  "updated_at": "2026-09-02T12:53:00Z",
  "integrity": {
    "algorithm": "sha256",
    "content_digest": "0000000000000000000000000000000000000000000000000000000000000000",
    "canonicalization": "jcs-rfc8785",
    "payload_included": true,
    "signature_reference": null
  },
  "authority_boundary": {
    "physical_control": false,
    "permit_issuance": false,
    "engineering_approval": false
  },
  "payload": {
    "documentation_sequence": [
      {
        "id": "IR-001",
        "state": "open"
      },
      {
        "id": "IR-002",
        "state": "open"
      }
    ]
  }
}
