{
  "artifact_id": "hs-template-commissioning-001",
  "artifact_type": "commissioning-checklist",
  "artifact_version": "0.1.0",
  "hazard_domain": [
    "hydrogen",
    "pressure",
    "ventilation",
    "gas-detection",
    "commissioning"
  ],
  "lifecycle_stage": "pre-commissioning",
  "scope": {
    "project_id": "replace-project-id",
    "facility_reference": "replace-facility-reference",
    "system_boundary": "Replace with the bounded pre-commissioning documentation scope.",
    "jurisdiction": null,
    "sensitive_data_embedded": false
  },
  "issuer": {
    "organization": "StegVerse-Labs",
    "role": "HydraSafe documentation author",
    "authority_class": "documentation-author"
  },
  "review_posture": {
    "state": "review-required",
    "required_roles": [
      "qualified-professional",
      "oem",
      "asset-owner",
      "installer",
      "operator"
    ],
    "completed_reviews": []
  },
  "canonical_references": [
    {
      "reference_type": "diamondops-canonical",
      "identifier": "StegVerse-Labs/DiamondOps-Core/docs/LIABILITY_BOUNDARY.md",
      "digest": null,
      "retrieved_at": null
    }
  ],
  "evidence_references": [],
  "status": "draft",
  "disposition": "review-required",
  "created_at": "2026-09-02T12:53:00Z",
  "updated_at": "2026-09-02T12:53:00Z",
  "integrity": {
    "algorithm": "sha256",
    "content_digest": "0000000000000000000000000000000000000000000000000000000000000000",
    "canonicalization": "jcs-rfc8785",
    "payload_included": true,
    "signature_reference": null
  },
  "authority_boundary": {
    "physical_control": false,
    "permit_issuance": false,
    "engineering_approval": false
  },
  "payload": {
    "items": [
      {
        "id": "COM-001",
        "description": "Required OEM commissioning documentation identified.",
        "state": "open",
        "evidence_reference": null
      },
      {
        "id": "COM-002",
        "description": "Pressure-system documentation and test evidence identified for qualified review.",
        "state": "open",
        "evidence_reference": null
      },
      {
        "id": "COM-003",
        "description": "Ventilation documentation and acceptance evidence identified.",
        "state": "open",
        "evidence_reference": null
      },
      {
        "id": "COM-004",
        "description": "Gas-detection documentation, calibration evidence, and alarm logic references identified.",
        "state": "open",
        "evidence_reference": null
      },
      {
        "id": "COM-005",
        "description": "Open commissioning deficiencies and responsible external parties recorded.",
        "state": "open",
        "evidence_reference": null
      }
    ]
  }
}
