{
  "artifact_id": "hs-template-permit-packet-001",
  "artifact_type": "permit-packet-framework",
  "artifact_version": "0.1.0",
  "hazard_domain": [
    "hydrogen",
    "pressure",
    "ignition",
    "ventilation",
    "gas-detection",
    "materials-compatibility"
  ],
  "lifecycle_stage": "planning",
  "scope": {
    "project_id": "replace-project-id",
    "facility_reference": "replace-facility-reference",
    "system_boundary": "Replace with the bounded documentation scope for the proposed hydrogen or reactive-gas facility.",
    "jurisdiction": null,
    "sensitive_data_embedded": false
  },
  "issuer": {
    "organization": "StegVerse-Labs",
    "role": "HydraSafe documentation author",
    "authority_class": "documentation-author"
  },
  "review_posture": {
    "state": "review-required",
    "required_roles": [
      "authority-having-jurisdiction",
      "qualified-professional",
      "oem",
      "asset-owner"
    ],
    "completed_reviews": []
  },
  "canonical_references": [
    {
      "reference_type": "diamondops-canonical",
      "identifier": "StegVerse-Labs/DiamondOps-Core/docs/LIABILITY_BOUNDARY.md",
      "digest": null,
      "retrieved_at": null
    }
  ],
  "evidence_references": [],
  "status": "draft",
  "disposition": "review-required",
  "created_at": "2026-09-02T12:53:00Z",
  "updated_at": "2026-09-02T12:53:00Z",
  "integrity": {
    "algorithm": "sha256",
    "content_digest": "0000000000000000000000000000000000000000000000000000000000000000",
    "canonicalization": "jcs-rfc8785",
    "payload_included": true,
    "signature_reference": null
  },
  "authority_boundary": {
    "physical_control": false,
    "permit_issuance": false,
    "engineering_approval": false
  },
  "payload": {
    "sections": [
      {
        "id": "scope",
        "title": "Facility and system boundary",
        "state": "open"
      },
      {
        "id": "jurisdiction",
        "title": "Jurisdiction and AHJ source record",
        "state": "open"
      },
      {
        "id": "codes-standards",
        "title": "Applicable code/standard source index",
        "state": "open"
      },
      {
        "id": "oem",
        "title": "OEM documentation index",
        "state": "open"
      },
      {
        "id": "hazards",
        "title": "Hazard review evidence references",
        "state": "open"
      },
      {
        "id": "drawings",
        "title": "Customer/qualified-professional drawing references",
        "state": "open"
      },
      {
        "id": "open-items",
        "title": "Open items and external-review dispositions",
        "state": "open"
      }
    ]
  }
}
