{
  "artifact_id": "hs-template-inspection-001",
  "artifact_type": "inspection-checklist",
  "artifact_version": "0.1.0",
  "hazard_domain": [
    "hydrogen",
    "pressure",
    "ignition",
    "ventilation",
    "gas-detection",
    "inspection"
  ],
  "lifecycle_stage": "inspection",
  "scope": {
    "project_id": "replace-project-id",
    "facility_reference": "replace-facility-reference",
    "system_boundary": "Replace with the bounded inspection-documentation scope.",
    "jurisdiction": null,
    "sensitive_data_embedded": false
  },
  "issuer": {
    "organization": "StegVerse-Labs",
    "role": "HydraSafe documentation author",
    "authority_class": "documentation-author"
  },
  "review_posture": {
    "state": "review-required",
    "required_roles": [
      "authority-having-jurisdiction",
      "qualified-professional",
      "asset-owner",
      "operator"
    ],
    "completed_reviews": []
  },
  "canonical_references": [
    {
      "reference_type": "diamondops-canonical",
      "identifier": "StegVerse-Labs/DiamondOps-Core/docs/LIABILITY_BOUNDARY.md",
      "digest": null,
      "retrieved_at": null
    }
  ],
  "evidence_references": [],
  "status": "draft",
  "disposition": "review-required",
  "created_at": "2026-09-02T12:53:00Z",
  "updated_at": "2026-09-02T12:53:00Z",
  "integrity": {
    "algorithm": "sha256",
    "content_digest": "0000000000000000000000000000000000000000000000000000000000000000",
    "canonicalization": "jcs-rfc8785",
    "payload_included": true,
    "signature_reference": null
  },
  "authority_boundary": {
    "physical_control": false,
    "permit_issuance": false,
    "engineering_approval": false
  },
  "payload": {
    "items": [
      {
        "id": "INS-001",
        "description": "Inspection scope and governing source references identified.",
        "state": "open",
        "evidence_reference": null
      },
      {
        "id": "INS-002",
        "description": "Observed condition records are linked to dated evidence.",
        "state": "open",
        "evidence_reference": null
      },
      {
        "id": "INS-003",
        "description": "Deficiencies are assigned to the responsible external authority or qualified party for disposition.",
        "state": "open",
        "evidence_reference": null
      },
      {
        "id": "INS-004",
        "description": "Reinspection or closure evidence requirements are recorded.",
        "state": "open",
        "evidence_reference": null
      }
    ]
  }
}
